sense,sing_pl,sentence
other,sing,peut-être lui manque-t-il un chant naturel et original et un peu plus de prononcé dans les intentions choses qui caractérisent le génie du fameux hayden à qui on ne peut reprocher que d'être quelquefois baroque quand il est épuisé par la quantité de traits de génie .
other,sing,rousseau dont la mélodie a le défaut d'être en même temps commune et baroque .
other,sing,voilà encore dans ce second couplet une façon de parler baroque que la tyrannie de la versification leur arrache .
other,sing,euterpe déesse de l'harmonie entre vivement et fredonne un italien baroque .
other,sing,c'est à toi seul que je la dois brutal durpetri dont la voix baroque et barbare a servi d'organe à la nature .
other,sing,le croirais tu imirce que cette bête malgré son ineptie et sa voix baroque ait la fureur de censurer la voix harmonieuse des cygnes et le chante délicat des jeunes oiseaux .
other,sing,quand ils furent arrivés à terre les matelots dont chacun était soutenu par deux sauvages furent conduits par un chemin étroit d'environ un quart de mille de longeur à leurs huttes où leur arrivé fut célébré au son d'un instrument très discordant qui n'était composé que de deux bâtons dentelés et acompagné d'une voix encore plus baroque et plus barbare .
other,sing,cela sera français selon vous et vous ferez un vers baroque .
other,sing,nous nous sommes souvent donné de la peine pour apprendre la cause de cet usage baroque .
other,sing,c'est beau vous disent ils en vous chantant quelque trait baroque .
other,sing,et confirme son dire burlesque par un trait encore plus baroque et qui ne sert plus guère que de lieu commun à tous nos faiseurs de contes .
other,sing,est un vers obscur et recherché vieillir de leur antiquité est une tournure baroque qui approche de la barberie .
other,sing,rends de ses mots la tournure baroque a ses discours donne un sens équivoque .
other,sing,détone à tort à travers prend de la dame en colère le ton baroque et les airs .
other,sing,enfin du p parti je n'entends plus le pas le q traînant sa queue et quelérant tout bas vient s'attaquer à l'u qu'à chaque instant il choque et sur le ton du k calque son ton baroque  et cetera .
other,sing,le q traînant sa queue et querellant tout bas vient s'attaquer à l'u qu'à chaque instant il choque et sur le ton du k calque son ton baroque .
other,sing,il importe peu que nos jeunes étourdis coupent leurs cheveux affectent une toilette baroque marchent sans graces montent à chevalier ridiculement estropient le français afin d'obtenir que quelque marchande de bouquets dise .
other,sing,a ce titre baroque et factice on reconnoit aisément l'auteur de la brochure ce protée littéraire qui depuis quelques années prend toutes sortes de formes non pas pour tromper ses semblables comme celui de la fable mais pour les éclairer et les intruire .
other,sing,a ce titre baroque et factice on reconnoît aisément m de voltaire l'auteur de cette brochure .
other,sing,il paraît un nouveau livre sous le titre baroque de l'an deux mille quatre cent quarante rêve s'il en fût jamais avec cette épigraphe .
other,sing,on en lisoit et l' on en peut lire encore la plus grande partie dans les ouvrages d'arnaud principalement dans l'écrit donné sous le titre baroque de pentalogus diaphoricus .
other,sing,où avez vous pris le titre baroque que vous donnez au public dans l'épître dédicatoire que vous lui adressez .
other,sing,pour étendre les leurs sur un acte équivoque ou sur un vieux titre baroque dont le chifre effacé rend le temps incertain .
other,sing,pour étendre les leurs sur un acte équivoque ou sur un vieux titre baroque dont le chiffre effacé rend le temps incertain je pense toutefois qu'il vaut mieux se deffendre .
other,sing,cependant ce n'est ici que de la théologie baroque .
other,sing,encore un terme baroque de logique .
other,sing,supposition aussi baroque qu'elle est insoutenable et contraire au bons sens .
other,sing,ce n'est pas monseiur que mon écriture souvent illisible mon style souvent baroque et indéchiffrable ne puisse vous servir d'excuse .
other,sing,il faut remarquer que les définitions dans cet ouvrage sont en général très claires et bien éloignées du style baroque et entortillé des jurisconsultes .
other,sing,je sais qu'à force de peine et de travail on peut se faire à toutes ces bizarreries et s'apprivoiser encore avec ce style baroque après s'être familiarisé avec les irrégularités affectées à la langue .
other,sing,je sais qu'à force de peine et de travail on peut se faire à toutes ces bizarreries et se familiariser encore avec ce style baroque après s'être familiarisé avec les irrégularités affectées à la langue .
other,sing,les baillifs concluent de ce style baroque et qui se sent encore de l'ancienne barbarie que ces quatre hauts justiciers étaient établis de toute ancienneté .
other,sing,mais elles sont écrites d'un style baroque capable d'effrayer le lecteur le plus intrépide et d'une dureté sans exemple depuis chapelain .
other,sing,naïveté suit ce style baroque qui réchauffant la plus froide équivoque en bel esprit il vous travestit un sot .
other,sing,naïveté suit ce style baroque .
other,sing,son style baroque répondoit à la bizarrerie et au déréglement de son esprit .
other,sing,et cette marche qui était toute de son invention formoit le spectacle le plus baroque et le plus ridicule .
other,sing,cependant l'habile anti-locke condamnoit cette ame à la mort pour l'âme n'ayant point de port ne sçachant où fourrer ce souffle si baroque il le détruisoit doucement ainsi qu'un foible son tiré d'un instrument .
other,sing,son départ va entraîner la dissolution de cette baroque société .
other,sing,ll y a dans le texte militia qui fait un sens baroque .
other,sing,quelques-uns composés de deux prépositions ou adverbes allemands seroient un sens bien baroque en les séparant .
other,sing,elle paraît d'abord effrayée et ensuite contrefait un rire baroque .
other,sing,zinca paraît effrayée et ensuite contrefait un rire baroque .
other,sing,et ce boileau tant vanté n'était qu'un rimeur baroque quand il a dit .
other,sing,et ce nonobstant clameur de critique satyre chagrine et même toute remontrance baroque de mon bon sénat l'académie française auquel nous interdisons dès-à-présent toute connaissance des contestations nées et à naître à ce sujet en réservant le jugement définitif à mondit successeur si le cas y échoit .
other,sing,je ne sais s'il fut jamais raisonnement plus baroque et moins probant .
other,sing,voilà un quoique que l'on m'avouera être très mal placé et qui fait un raisonnement baroque .
other,sing,de dix vers blancs où le bons sens domine que de forger et bistourner exprès prose baroque où la rime chemine .
other,sing,mais en se regardant les uns et les autres sur un procedé si baroque ils ne purent s'empêcher de rire .
other,sing,elle accourut et reprocha tant qu'elle put au grand oiseau ce procédé baroque .
other,sing,mais en se regardant les uns et les autres sur un procédé si baroque ils ne purent s'empêcher de rire .
other,sing,d'autre part il avait la prétention - baroque chez lui - de réhabiliter les filles publiques .
other,sing,il n'y a pas de plus grand défaut que celui là si ce n'est peut être celui d'un poète baroque qui prend une bizarrerie grotesque pour l'originalité une trivialité bouffonne pour de la gaieté naïve et qui estropiant sans cesse la langue et disloquant la poesie choque à la fois le plus rudement du monde le bon goût le bons sens et l'oreille .
other,sing,le mexique conquis poème baroque .
other,sing,le plaidoyer baroque de l'intimé dans racine fut calqué sur ceux que l'on débitoit tous les jours au palais .
other,sing,le plaidoyer baroque de l'intimé dans racine ouvrit les yeux .
other,sing,cette pièce baroque a été imprimée avec des notes .
other,sing,ce dialogue fixa mon attention sur un personnage assez baroque assis devant une table du café du caveau côté de philidor occupé d'un petit verre qu'il achevoit à plusieurs reprises .
other,sing,les deux premiers numéros du journal de camille desmoulins n'ont servi qu'à jeter de nouveaux doutes sur l'opinion que je m'étois formée du caractère intermittant de ce baroque personnage .
other,sing,mais je ne puis soutenir le personnage baroque et dénué de vraisemblance qu'on fait jouer à ce huron sur la scène .
other,sing,je fis encore avec la comtesse et l'abbé une partie plus baroque que celle-ci .
other,sing,je ne crois pas qu'on ait jamais pu inventer un outil aussi baroque .
other,sing,momus ce dieu porte marotte souverain de la gent falotte ayant trouvé certain écrit qui dans lutece fait grand bruit appellé marie alacoque voulut s'éclaircir en secret pourquoi donc un chacun s'en mocque et le traite d'oeuvre baroque qui mérite peu de respect .
other,sing,c'est un nom si baroque .
other,sing,ce nom baroque passoit ci-devant pour désigner une espèce de terre calcaire très fine .
other,sing,ceux qui l'ont fait ont imaginé un nom baroque pour cacher celui du véritable auteur et ils le supposent écrit à rome .
other,sing,christine trouvant son nom baroque le nomma struzzo .
other,sing,elle m'a dit que je les trouverois en demandant le nom d'une autre de leurs filles  puisqu' elle doit être l'unique dans le royaume qui porte un nom si baroque .
other,sing,le moindre plat c'est lui qui l'intitule d'un nom baroque et très mal assorti .
other,sing,le mot allemand est erd-apfel ou erd oepfel ce qui a produit le nom baroque de artoffel .
other,sing,nom baroque qu'on donne en logique à un syllogisme dont la majeure doit être universelle affirmative la mineure universelle négative et la conclusion particulière négative .
other,sing,un milord au nom baroque à l'esprit aimable m'a rendu une lettre de votre part .
other,sing,je ne veux parler ici et dans tout le reste de ma letter que de cette réforme subite et totale qui en voulant ramener tout-à-coup l'orthograph à la prononciation feroit de notre langue une langue barbare inintelligible aux yeux et indéchiffrable de ce néographisme baroque tel qu'il a été proposé autrefois par ramus et après lui par pelletier maigret l'abbé de saint-pierre de launay et quelques autres tel enfin que semblent le proposer les auteurs du vocabulaire .
other,sing,ainsi puisse prospérer la musique baroque dans le profane  puisqu' elle n'y est ni plus significative ni plus scandaleuse qu'une grêle de coups qu'on feroit tomber sur un coffre .
other,sing,c'est le travers dans lequel donne la musique baroque .
other,sing,de baroque musique faites un choix fabriquez moi un opéra car tel qu'il sera on l'applaudira .
other,sing,il donne avec beaucoup de raison pour département à la musique baroque les spectacles et les concerts où elle ne peut être ni plus significative ni plus scandaleuse qu'une grêle de coups qu'on feroit tomber sur un coffre .
other,sing,il donne pour département de la musique baroque les théâtres et concerts pour n'y amuse que par du bruit sans s'embarrasser de rien exprimer .
other,sing,il fait ensuite une division de la musique en musique chantante et musique baroque .
other,sing,ils ne peuvent manquer de plaire à ceux qui préférent aux difficultés d'une musique baroque un chant agréable varie et semé de traits neufs .
other,sing,l'auteur parcoure les divers ridicules qu'il croit devoit reprendre dans le goût moderne et il s'élève ainsi contre la musique baroque .
other,sing,l'intention des assemblées chrétiennes et les sujets qui s'y chantent sont incompatibles soit avec les boutades soit avec la précipitation de la musique baroque .
other,sing,la musique baroque restera en possession des spectacles et des concerts publics où la musique chantante causoit autrefois des maux infinis .
other,sing,la perte de tant d'excellens sujets que cette musique baroque ne manqueroit pas d'entraîner m'en rapelle un autre qui vous causera d'abord la plus grand consternation .
other,sing,le poème est si mauvais que les acteurs même n'y peuvent déployer aucun jeu et la musique si baroque que le chanteur n'y trouve rien à exprimer .
other,sing,leur disoit-elle nous nous acommoderons je ménagerai une transactions entre la musique baroque et la musique .
other,sing,mais quel avantage pourra-t-on tirer de la musique baroque .
other,sing,notre auteur appelle cette musique baroque il donne à l'autre le nom de chantante .
other,sing,nous la nommerons la musique baroque .
other,sing,on entendoit quelques pétards puis on se promenoit dans une vaste solitude sous des galeries mal peintes au son d'une musique baroque .
other,sing,on s'est lassé de se promener en long et en large ou plutôt d'être coudoyé en tout sens dans un salon et sous des galeries mal peintes au son d'une musique baroque .
other,sing,on trouva sa musique baroque et barbare .
other,sing,par exemple il pourra comme l'a déjà fait un musicien parfaitement convaincu du vrai usage de la musique baroque .
other,sing,pour faciliter à l'amiable les progrès de la musique baroque et pour décréditer ou ruiner dans les familles le dangereux goût des chants du siècle passé il sera permis aux villes les plus médiocrement riches de se donner à grands frais un opéra ou du moins un concert public où les honnêtes fainéants du pays puissent avoir à discrétion des sonnates qui ne significen rien et de l'italien qu'ils n'entendent point ou du français qui se convertit pour eux en arabe par les cascades et par les hoquèts de la prononciation .
other,sing,retournez chez vos compatriotes et leur faites entendre votre musique baroque qui n'a ni sens ni raison .
other,sing,si cela est comme on n'en peut pas douter ne soyons point étonnés de la musique baroque dont on nous écorche aujourd'hui les oreilles .
other,sing,une musique baroque est celle dont l'harmonie est confuse chargée de modulations et de dissonances le chant dur et peu naturel l'intonation difficile et le mouvement contraint .
other,sing,une musique baroque est celle qui est chargée de modulations trop dures à l'oreille et dont le mouvement est interrompu mal à propos et cetera .
other,sing,une musique baroque est celle dont l'harmonie est confuse chargée de modulations et dissonances le chant dur et peu naturel l'intonation difficile et le mouvement contraint .
other,sing,le titre seul du coup d'oeil purin fort étendu en donne l'explication et sert comme de commentaire à ce mot baroque .
other,sing,mais un mot baroque qu'ils répètent si souvent a enfin forcé mon attention .
other,sing,un enfant qui sait ce mot baroque est fort instruit pour la société .
other,sing,voilà un mot bien baroque .
other,sing,l'espèce de foire qu'il imaginée pouor l'émulation des arts et métiers conduit à celle d'un établissement durable où chaque invention nouvelle puisse s'annoncer aux curieux et s'offrir à la comparaison où tous les genres d'industrie ancienne puissent se retrouver et réclamer contre le caprice et la mode baroque qui les ont fait oublier .
other,sing,et dont l'esprit répond à la mine baroque .
other,sing,on nous donne quelque menuet baroque .
other,sing,je le domande à tout homme qui a connaissance de nos caractères élémentaires et du son que nous leur avons affecté comment s'il ignore l'italien pourra t il dans ce méchanisme baroque abé glie découvrir la véritable prononciation du mot abeille .
other,sing,il y a des tuyaux de mer qui sont repliés contournés en spirale en manière de vis roulés les uns sur les autres régulièrement comme des pains de bougier ou d'une manière si baroque que l'on a peine quelquefois à en trouver les extrémités .
other,sing,ils passent deux heures à composer un manuscrit qu'il écrivent d'une manière baroque .
other,sing,je défie tout écolier de logique de déraisonner dans ses essais de syllogisme d'une manière plus baroque .
other,sing,l'auteur orthographie d'une manière baroque .
other,sing,le vers non si je ne puis t'attendrir est surtout rendu d'une manière baroque et ridicule .
other,sing,manière baroque et à laquelle on se fait très difficilement .
other,sing,on réimprime ce livre baroque à paris .
other,sing,il n'y a point de langue si baroque qui n'ait trouvé des partisans zélés .
other,sing,elle vit que les habitans étaient dans des contestations perpétuelles un même esprit d'une chicanne peu différente les animoit dans leurs querelles et un langage également baroque servoit à les exprimer celles du païs ou l'on entroit en mauvais latin et celles du climat que l'on quittoit en un jargon qui tenoit de l'ancien roman qui n'était ni français ni latin .
other,sing,en un mot c'est un langage si baroque si étrangement néologique qu'on peut assurer qu'un étranger qui saurait parfaitement notre langue et qui lirait couramment nos classiques ne pourrait pas lire un e page de m deleyre sans être arrêté à tout moment et sans demander si l'auteur a parlé français et ce qu'il a voulu dire .
other,sing,ensuite ronsard avec son même langage baroque décrit comment la sience poétique passa de l'orient en occident et parvint en angleterre .
other,sing,envoyez moi donc je vous prie l'énumération de vos infirmités et de vos misères en termes barbares et en langage baroque et cela avec toute l'exactitude possible .
other,sing,je vous dirai mon cher ami que je m'exprime plus aisément maintenant dans ce langage baroque et musical que je n'ai jamais fait en français .
other,sing,la philosophie du dogme et des controverses y introduit un langage baroque et néologue qui acheva leur ruine .
other,sing,leur langage baroque effarouche les graces et fait fuir les amours qui voloient sur leurs traces .
other,sing,ce qui a formé une jurisprudence baroque et non uniforme que l' on a insérée dans ces coutumes comme une loi invariable à suivre .
other,sing,les juges défendent leur jugement baroque par l'autorité du roi qui a toujours déclaré qu'il ne vouloit pas de sang répandu dans cette affaire .
other,sing,illustre aimable et digne abbesse il n'est donc que trop vrai qu'à paris comme à rome à vienne au paraguay a stokolm à berlin tout ainsi qu'à gonesse le premier jour de lan est de nos douze mois le jour le plus baroque et plus bavard le plus sournois le plus maussade enfin le plus équivoque .
other,sing,vu le jeu baroque et maussade de la troupe de lelio chétif et pityoable écho de collège et de parade .
other,sing,vu le jeu baroque et maussade de la troupe de lelio et de collège et de parade .
other,sing,vu le jeu baroque et maussade de la troupe de lelio reste d'un miserable écho de collège et de parade .
other,sing,d'imbéciles fainéants et fainéantes qui végetent dans les villes et qui comme les perroquets ne savent que proférer des mots vuides de sens et d'idées se croient beaucoup d'esprit quand ils tournent en ridicule d'honnêtes et de sages agriculteurs qui ne comprenant rien à leur jargon baroque et d'amusant pour l'instant de leur folle étourderie les méprisent en les plaignant .
other,sing,je lui fis la révérence et lui dis que j'étais fort sa servante et qu'il fallait aller chez mon maître sur quoi conversation m'a poursuivie en un jargon baroque jusqu'à ce qu'il me perdit de vue .
other,sing,non seulement on est fatigué au bout de trois pages de leur tournure bizarre et de leur jargon baroque mais ce qu'il y a de pis c'est qu'on y trouve très peu d'esprit et pas une idée sur l'art .
other,sing,non seulement on est fatigué au bout de trois pages de leur tournure bizarre et de leur jargon baroque .
other,sing,n'aveignez point cet instrument baroque rauque qui nous fait trembler tous .
other,sing,un jour donc que siméon n'était pas triste il entre dans une boutique pleine de vessies en prend une et après y avoir ajusté un tuyay de plume et divers chalumeaux il s'en va dans un carrefour de la ville et joue publiquement de son baroque instrument .
other,sing,l'absolution conférée par un prêtre sans approbation de l'évêque est invalide et de nul effet c'est l'inductin la plus baroque et la plus absurde qu'on puisse imaginer n'ayant aucune liason avec le principe établi d'où on l'infére .
other,sing,ses autres ouvrages ont été admirés des uns comme ayant la noble simplicité de l'antique et critiqués des autres comme portant les traits d'une imagination baroque et contraire au bon goût .
other,sing,cette idée baroque fait faire une action dangereuse à ceux qui en sont imbus .
other,sing,cette réflexion qui a fait toujours sur mon esprit une impression plus vive que les trames les complots et les conjurations dont on nous fatigue depuis long-temps n'a pas agi avec la même force sur l'âme de nost représentants cars ils n'hésiteroient pas à nous donner un papier national et ils auroient résisté à l'idée baroque et mal faisante de fondre notre argenterie nos boucles et nos saintes-vierges .
other,sing,dussiez vous cependant trouver mon idée baroque je ne suis point fait pour dissimuler avec vous .
other,sing,et je protette à la face de la nation qu'aucun de nous n'en porta jamais de cette couleur ni n'eut même l'idée baroque d'en porter .
other,sing,le docteur se mettroit peut-être de mauvais humeur et se fâcheroit si l' on vouloit s'égayer et rire de son idée baroque .
other,sing,mais il me semble qu'il est vraisemblable et qu'il donne un fondement raisonnable à cette idée baroque .
other,sing,messieurs les inamovibles du régiment de guyenne se sont mis dans la tête une idée tout-à-fait baroque .
other,sing,néanmoins il entre ce peu de caractéres il s'en trouve seulement un de chaque côté qu'elle puisse unir c'en est fait elle les allie et en forme une idée baroque qui pourra lui representer un livre soit même son existence à rome et pourtant à paris et cetera .
other,sing,on doit cependant regarder comme une idée baroque l'homme qui est culbuté dans un coin du tableau et dont on ne voit que les jambes le reste étant supposé hors de la toile .
other,sing,mais les suisses ne sont point constipés et ils sont d'un bien meilleur tempérament encore et je ne conçois pas ce qu'on prétend gagner à recuire et à distiller une humeur baroque pendant huit ou quinze jours .
other,sing,lorsque otus furent placés commodément le médecin de mon père fit une histoire baroque de la maladie depuis sa naissance jusqu'à ce jour .
other,sing,suivant l'histoire baroque de cet emprisonnement la pacha feignit de consentir à la demande des mutins à condition qu'il tenteroit encore une fois une sortie générale .
other,sing,au milieu de cette foule de grands hommes qui croiroit que la nobile direzzione de milan se soit adressée à un allemand à un barbare au chevalier gluck enfin qui selon plusieurs connaisseurs de café n'a ni chant ni mélodie n'a qu'une harmonie baroque et criarde un style tudesque usé raboteux qui n'a aucune réputation en italie et n'y a eu aucun succès .
other,sing,n'a qu'une harmonie baroque et criarde un style tudesque usé raboteux qui n'a aucune réputation en italie et n'y a eu aucun succès .
other,sing,les lettres n'étant faites que pour l'amusement des peuples ce genre baroque y contribuoit tout aussi bien que les genres à prétention .
other,sing,huit sujets de danse joueur d'instrument genre baroque peint en mignature d'un beau faire .
other,sing,quelques artistes se sont élevés contre ce genre baroque mais la multitude ignorante a conservé ses préjugés et suivi le torrent .
other,sing,des cazeaux des granges m demeurant à londres a traduit de l'anglois en français baroque la prétendue veuve et composé dans le même style la femme jalouse .
other,sing,les noms classiques d'amaryllis de silvie de mirthille frappent d'étonnement dans la foule baroque de plantes obscures et sans propriétés comme hemerocalle macre arroche .
other,sing,il a la fantaisie baroque de jouer un rôle dans la grande tragédie sans cannoniers sans artilleurs .
other,sing,le procès de m le comte de guines a effetivement été jugé avant hier au châtelet d'une façon très baroque .
other,sing,et que cette expression baroque veut dire jusqu' au dernier soupir .
other,sing,expression baroque comune en certaines provinces .
other,sing,l'épaule le coude et la main forment souvent un triangle vertical ce qui la fait pagoder si j'ose créer cette expression baroque mais qui rend ma pensée .
other,sing,traiter d'emblée est un expression baroque .
other,sing,mais voyant ensuite comme moi que cette hypothèse ne pouvoit satisfaire qu'à quelques cas particuliers il en vient à l'explication la plus baroque .
other,sing,c'est chez la marquise de felcourt que j'ai entendu le concert dont l'éxécution baroque m'a fourni le détail que je viens de vous faire .
other,sing,disons doc que si le saint était monliniste loin de le regarder comme le plus grand génie qu'il y ait eu il faut le regarder au contraire comme l'esprit le plus baroque et le plus de travers .
other,sing,il faudroit avoir l'esprit bien baroque pour soutenir que l'électeur palatin se soit laissé subjuguer par une crainte ou surprendre par les manéges du cabinet de vienne .
other,sing,mais comme c'est un esprit baroque il voudroit de l'extraordinaire et il m'a chargé de lui chercher un poète et un musicien .
other,sing,n'y a-t-il pas aussi un peu d'âcreté dans ce que vous dites de m le miere dont vous blâmez l'esprit baroque et le peu de goût .
other,sing,oh lui c'est un esprit baroque dont nous rendrons bon compte .
other,sing,sais-tu qu'en honneur ces français ont une tournure d'esprit baroque .
