sense,sing_pl,sentence
other,sing,si je ne m'y rends pas traitez moi d'esprit baroque de mauvais raisonneur .
other,sing,toujours dans le plaisir je vis dans ma bicoque je n'y reçois jamais aucun esprit baroque .
other,sing,quittés le baroque esclavage qu'elle vous impose .
other,sing,alors je jetai pour la première fois les yeux sur ce valet si apprivoisé et je reconnus malgré un équipage tout-à-fait baroque l'abbé de gaudigny neveu de notre abbesse .
other,sing,il fit une enterprise baroque .
other,sing,c'est pourquoi ils ont imaginé une écriture baroque illisible dont tous les caractères sont extrêmement gros et étendus .
other,sing,la beauté sans manière offre un éclat baroque et l'esprit sans jargon est d'un bourgeois qui choque .
other,sing,mais quelque chinois que soient les chinois il n'est pas possible qu'ils fassent usage d'une échelle si baroque .
other,sing,reponse du chevalier à cet argument par la distinction baroque et confuse des causes matérielle et formelle efficient et finale .
other,sing,voilà déjà une distinction assez baroque et qui pourroit bien déceler un petit coup de marteau .
other,sing,on est d'abord étonné de voir une disposition si baroque et si peu propre à faire honneur aux talents du vice grand maitre .
other,sing,je veux pourtant chanter de ma voix rauque ce valory ce fameux champion qui par l'effet de son destin baroque des prussiens fut le palladion et pour lequel se fit mainte blessure quand les housards fins et rusés matois de l'enveler essayant l'aventure autour du camp venaient en tapinois .
other,sing,je veux pourtant chanter de ma voix rauque ce valory ce fameux champion qui par l'effet de son destin baroque des prussiens fut le palladion .
other,sing,refusons plutôt au grecs toute espèce d'harmonie que de leur attribuer une désinence harmonique de cette espèce désinence plus baroque que notre ton du quart et notre tierce de picardie .
other,sing,rosanie est dans le genre de la féerie et avec tout l'appareil du merveilleux ne présent qu'une intrigue très commune et un dénouement baroque dénué de sens commun .
other,sing,c'est en effet ce qui se pratique lorsque le conseil d'état se relâchant du despotisme odieux qu'il exerce ouvertement sur les communautés sur l'injuste prétexte d'un droit imaginaire auquel il a donné la baroque dénomination de droit de haute police il ne leur ferme pas la porte de justice en leur refusant net le secours des tribunaux et les jugeant prévotablement .
other,sing,de là il tombe à corps perdu comme du troisième ciel sur son prêche qui n'est qu'une course baroque par monts et par vaux .
other,sing,d'où l'on pouroit conclure qu'il auroit trompé ce prince qu'il se seroit moqué de lui en lui faisant présent d'un copie aussi baroque aussi informe .
other,sing,dites vous monsieur de ce conte baroque .
other,sing,je ne crois pas qu'il puisse y avoir une construction plus baroque que celle de ces vers .
other,sing,la bonne grace du pitaut reparoit assez le défaut de sa construction baroque et les peu séduisants appas du nez camus n'invitoient pas a profiter de l'équivoque .
other,sing,comment ne pas rire de ces anglais si fiers de leur constitution baroque royale mobiliaire aristocratique et qui nous dénigrent lorsque nous travaillons à nous en donner une ui doit nous garantir de tout le mal qu'ils nous reprochent d'avoir fait et nous guérir de celui que nous ont fait les rois dont ils sont encore les rampans idolatres .
other,sing,je suis persuadé qu'il n'y eut tout au plus que quelques vieilles qui trouverent bonne cette consequence et que toutes les jeunes au contraire auroient souhaité de tout leur coeur de faire une fréquente expérience du principe dont le prédicateur avoit tiré sa conclusion baroque .
other,sing,ils exécutaient des morceaux très difficiles sans clopiner le moins du monde et l'entrepreneur de ce concert baroque me dit qu'il se faisoit fort de styler en six mois par la méthode en question quarante sujets qui ne fussent pas la musique en fixant l'attention du monotone à un seul ton à exécuter à livre ouvert les morceaux de musique les plus difficiles .
other,sing,je lui dirai ma façon de penser avec modération et je me dirai que je ne dois pas être excepté de la nombreuse classes de ceux qui fonts des ingrats quoiqu'il en soit voilà une bonne affaire finie que l'acuittement de ce compte baroque .
other,sing,termes prétieux que l'on ne prononce point sans pincer les lèvres assortiments monstrueux des grotesques de la néologie et le comportement baroque le métalent ridicule la bouffissure éfarée du jargon à la mode .
other,sing,il y auroit encore bien d'autre choses à apprendre à m m comme à ne pas faire de comparaison aussi baroque que celle d'un médecin et son malade avec un cocher et ses chevaux à se désier de ses idées auprès des malades à disserter moins et à s'entendre mieux .
other,sing,si la comparaison baroque du médecin de saint germain avec le médecin de cos faite au même endroit était proposable ce ne pourroit être à cause de la médecine originale du premier .
other,sing,elle n'aurait pas été capable de faire un choix si baroque .
other,sing,le tout fut accompagné par une musique ou chant chinois fort baroque et des plus désagréables quoique cadencé ou mesuré et qu'ils exécuterent principalement devant la couleuvre en lui faisant faire en même temps différents mouvements très singuliers .
other,sing,admirable dans un petit nombre de scènes mauvais presque partout ailleurs ce qui est peut-être autant la faute du genre que la sienne car c'est souvent pour avoir trop voulu s'asservir à la déclamation qu'il a rendu son chant baroque et ses transitions dures .
other,sing,car c'est souvent pour avoir trop voulu s'asservir à la déclamation qu'il a rendu son chant baroque et ses transitions dures .
other,sing,un oiseau dont la voix est rauque peut il d'un chant aussi baroque vous faire ouir de médiocres sons .
other,sing,cette cérémonie baroque a duré trois heures .
other,sing,nous y vîmes une cérémonie baroque .
other,sing,amelot qui le savoit bien lui demanda pourquoi il ne s'était pas contenté de censurer en gros quelques propositions de quesnel qu lieu de faire une censure baroque de cent et une .
other,sing,quelque censeur baroque qui demande du goût de la précision et de la vrai semblance par tout trouvera peut-être cette exhortation beaucoup trop longue pour un mourant .
other,sing,c'est un caractère baroque .
other,sing,car quelles oreilles autres que celles d'un physiologiste ou d'un anatomiste familiarisés avec les phrases tirées du grec pourroient patiemment supporter l'articulation baroque du moins par rapport à notre langue des mots cricoïdes geniohydiens stylo cerato-hydiens nio-hyoïdiens milo-hyoïdiens coraco-certo-hyoïdiens pharo-gastophilins employés pour désigner les fonctions des divers muscles qui concourent à la déglutition .
other,sing,cet arrangement baroque fut accepté .
other,sing,mais quel arrangement baroque dans ces expressions .
other,sing,adieu m le démonstrateur avec votre démonstration je vous jure que si vous avez voulu me démonstrer la confusion de vos idées et le néant de votre système vous avez parfaitement réussi dans votre argument baroque que vous venez afficher ici pour une démonstration .
other,sing,après cet argument baroque chacun opine de la toque .
other,sing,ces trois termes font un argument baroque auquel un sauvage n'est pas en plus état de résister qu'un huguenot .
other,sing,d'où l' on tire un argument baroque pour prouver que tous les hommes sont obligés de subir la circoncision .
other,sing,lorsque je voyois que le sommeil alloit rallentir leur feu je poussois de mon palanquin un argument aussi baroque que leurs faces .
other,sing,après quoi un chanteur aussi du premier ordre nous heurla avec des nazonnemens insupportables l'air le plus mélancoliquement baroque qu'il soit possible d'entendre .
other,sing,il chante l'air le plus baroque et le plus ancien .
other,sing,on appelle un homme de goût un homme qui sait les vaudevilles du temps et qui les a de la première main qui fait quelquefois une parodie sur un air baroque que la protection d'une femme a mis à la mode .
other,sing,on s'embarrasse très peu que le pièce soit bonne ou mauvaise pourvû qu'en sortant du spectacle et en pirouettant sur un talon rouge on puisse frédonner quelques mesures d'un air bien baroque qui n'ait pas la moindre analogie avec les paroles .
other,sing,il est vrai qu'il a l'accent un peu baroque aussi bien que nous .
other,sing,le titre en est très baroque et très long .
other,sing,mais en conscience convenez donc que la tendresse des vieilles gents est baroque .
other,sing,la phrase en elle même est baroque .
other,sing,la musique qui est du sieur rameau est à son ordinaire baroque et fort médiocre dans le cours de la pièce mais admirable dans les choeurs .
other,sing,le mérite est toujours baroque .
other,sing,l'ancienne manière de placer les pelotons et compagnies dans le bataillon était assez baroque et n'était fondée sur aucune raison qui méritât quelque considération .
other,sing,cette loi seroit baroque en ce qu'elle permettroit à un ecclésiastique d'avoir trente mille livres de revenu en un seul bénéfice et ne lui permettroit pas d'avoir en deux ou plusieurs bénéfices plus de trois mille livres .
other,sing,cette loi seroit encore baroque dans le cas où ecclésiastique très propre à l'état de curé désirant même de se rendre utile dans l'état pastoral et possesseur d'un bénéfice simple plus riche que la plupart des cures seroit nommé curé d'un paroisse .
other,sing,figaro se pique d'être grammairien quoique son langage soit souvent baroque et qu'en se servant de termes didactiques il les estropie par fois je le lui pardonne .
other,sing,l'intrigue des comedies est souvent aussi baroque et aussi monstrueuse que celle des pièces tragiques .
other,sing,votre rameau il est sec il est sauvage il n'a jamais su arranger un partition il n'a jamais de chant son harmonie est si baroque si revêche .
other,sing,les seconds que cela choque disent que gluck est baroque qu'en france avant son époque le vrai beau se décida .
other,sing,les seconds que cela choque disent que gluck est baroque .
other,sing,la frase en elle même est baroque .
other,sing,il seroit plus en état qu'un autre de remplacer par là le défaut de talent et de génie si cet esprit était moins baroque et qu'il fut accompagné de plus de goût .
other,sing,nous ne dissimulerons pas qu'il seroit plus en état qu'aucun autre de remplacer par là le défaut de poésie et de versification si cet esprit était moins baroque et dirigé par un goût plus sur et plus exercé .
other,sing,cette écriture est si baroque qu'on pourroit la lire en vingt façons différentes .
other,sing,au surplus une ortographe ridicule et une composition bizarre forment tout ce qu'il y a de remarquable dans cet ouvrage où comme dans les autres productions de m de la bretonne l'auteur n'a été que baroque en se persuadant qu'il était original .
pearl,sing,une perle de bel orient forme un peu baroque deux percés en deux endroits pesant quarante neuf grains trois seizes ou douze karats sept seizes estimée cinq cents livres .
pearl,sing,une perle forme losange un peu baroque ayant plusieurs ondulations sous le dessous percée à deux endroits de bel orient pesant 41 grains deux seizes ou dix karats six seizes estimée quatre cents livres .
pearl,sing,une perle d'orient un peu nacreuse ovale un peu baroque étant percée à deux endroits pensant quatre huit grains ou douze karats septs seizes estimée cinq cents livres .
pearl,sing,une perle de bel orient forme en poire un peu baroque et percée pesant soixante six grains deux seizes ou  seize karats dix seize estimé huit cents libres .
pearl,sing,une perle de bel orient forme en poire un peu baroque un fort cran dans la partie du haut et un peu matte dans celle du bas percée pesant cinquante-quatre grains deux seizes ou treize karats dix seizes estimées quatre cents livres .
pearl,sing,une perle de bel orient forme ovale baroque ayant une côte et percée pesant soixant douze grains trois seizes ou dix huit karats trois seizes estimée douze cents livres .
pearl,sing,ainsi nous disons perle en pointe ou en poire perle ronde perle ovale perle baroque .
pearl,sing,covarruvias au mot barrueco dit que ce mot espagnol qui signifie une perle baroque a été fait du latin verruca à cause de la ressemblance de ces perles à des verrues .
pearl,sing,qu'est-ce que borneo au prix de bisnagar et quelle comparaison y a-t-il entre une perle baroque et une perle parfaite .
pearl,sing,tympania de pline est une espèce de perle baroque que nos joalliers nomment tambourins elle a la figure d'une tymballe .
pearl,sing,une perle baroque d'une volume extraordinaire creusée en forme de flacon et ornée d'un couvercle et d'une chaine d'or .
pearl,sing,une perle baroque et de vilaine eau de quelque poids qu'elle soit ne sauroit valoir la fameuse pèregrine .
pearl,sing,une perle baroque très joliment montée en or émaillé .
pearl,sing,une perle d'orient un peu nattée forme baroque doux ayant des ondulations une gersure un peu jaunâtre et percée pesant cinquante-deux grains deux seizes ou treize karats deux seizes estimée cinq cents livres .
form,pl,les six spires qui forment la volute sont baroques bossues et striées ver le sommet .
form,pl,fleurs de lys à têtes aigues ou baroques et sans presque d'oreilles lions aigles et autres de blason coliers de saint michel et du saint esprit et autres petits objects mal exécutés .
form,pl,toute sa surface extérieure est ornée de taches longitudinales étroites baroques de couleur fauve ou canelle lesquelles s'étendent dans toute l'étendue de la coquille .
form,pl,les cannelures intermédiaires sont spacieuses profondes et à stries longitudinales onduleuses et baroques .
form,pl,cette espèce ne diffère du pigeon blanc à coquille épaisse que par sa forme moins large bossue en dessus comme en dessous principalement dans les spires qui sont tuberculeuses d'ailleurs et très baroques .
form,pl,coquille univalve du genre des buccins d'une forme ramassée renflée et composée de cinq spires convexes irrégulières et baroques ou comme tordues et de travers .
form,pl,ces pierres sont branchues baroques quelquefois percées de part en part par des trous ronds .
form,pl,a carthagene dans la même guianne on trouve des coquillages pareils à ceux des autres côtes et des mères-perles qui sont plus baroques et d'un oeil moins éclatant que celles du golfe persique .
form,pl,il y a des mères-perles mais elles sont plus baroques et d'un oeil moins éclatant que celles du golfe persique .
form,pl,les différentes formes que donnent à leur habits les teignes aquatiques sont peut être encore plus baroques que celles que nous avons vu jusqu'a présent .
form,pl,les perles sont des petits corps ronds ou baroques qui se trouvent dans les mers tant d'orient que d'occident .
form,pl,etant en cet état vous les retirerez et vous en formerez des perles de la grosseur et de la figure que vous les désirerez soit rondes baroques ou en poire selon la forme que vous aurez donné aux moules que vous aurez fait faire qui doivent être d'argent de coupele et dorez au dedans .
form,pl,les valves sont épaisses baroques dans leur forme et si bombées que leur convexité égale la largeur de la coquille qui porte deux pouces et demi ou moitié moins que sa longeur .
form,pl,de là on a appliqué cette épithète à toutes les formes singulières et elles ont toutes été appelées baroques .
form,pl,elles sont baroques plates cambrées de différentes manières plus ou moins transparentes et fragiles .
form,pl,il en est absolument de même des concrétions argileuses qui à ces égards ne différent des silex qu'en ce qu'elles sont moins baroques dans leurs formes et sont en général plus grandes de sorte que la seule différence caractéristique entre ces deux classes de nodules est que dans le silex il y a métamorphose de la substance au lieu que dans les concrétions argileuses il n'y a que simple pétrification .
form,pl,elle est remarquable d'ailleurs par deux fortes tubercules baroques qui dominent extrêmement sur les autres lesquels parcourent et couronnent régulièrement les neuf ou dix spires dont la volute est composée .
form,pl,elle est ainsi appellée à cause que la surface extérieure de ses battans est garnie de lames saillantes et courbées en manière de tuiles ou de faitieres qui sont arrangées avec assez de symétrie sur plusieurs grosses côtes longitudinales larges et convexes lesquelles sont interposées avec autant de larges cannelures avec des stries baroques qui suivent la même direction .
form,pl,la volute est composée de cinque ou six spires baroques étagées et comme anéanties dans les tubercules .
form,pl,malgré les replis baroques et les plus variés de cette huître singulière ainsi que l'irrégularité de ses contours .
form,pl,une terre labourable contiguë à cet endroit du marais d'oranche où l' on a creusé pour en tirer de la terre crétacée et qui n'en est séparée que par un fossé est toute parsemée de pierres calcaires branchues baroques quelquefois percées de part en part par des trous ronds .
form,pl,ne voit-on pas dans tous les cabinets des pétrifications de coquilles contournées en cent façons différentes des cornes d'ammon des nautilites dont les chambres ont pris les formes les plus baroques es bivalves déplacées et aplaties sans être brisées .
form,pl,quelques ouvriers avoient essayé d'imiter ces tabatieres mais en donnant à un cuir mal apprété des formes si baroques que leurs ouvrages ne pouvoient obtenir la préférence et le débit .
form,pl,un rang composé de vingt huit perles plates à peu près d'égale grosseur plusieurs d'un bel orient les autres mattes jaunes et formes baroques pesant avec le fil six cents quarante trois grains poids de marc estimées quinze cents livres .
form,pl,v m comprend que dans une formation de cette nature ces concrétions doivent prendre des formes très baroques .
form,pl,il y en avoit de ronds comme des boules d'autres plus aplatis d'autres oblongs et d'autres de figures très baroques mais toujours ayant leurs angles abbatus .
form,pl,j'ai observé plusieurs fois au microscope non sans étonnement les figures baroques et singulières des petits vers qui forment cette matière blanchâtre qui croît entre les dents humaines .
form,pl,il y a beaucoup les huîtres ont les coquilles si baroques qu'on ne peut les ouvrir qu'à coups de marteau .
form,pl,les huîtres ont les coquilles si baroques qu'on ne peut les ouvrir qu'à coups de marteau .
form,pl,et l'on préféroit les pierres de couleur qui étaient communes alors et que l'on tailloit grossièrement dans la mine en gros cabochons baroques tels qu'on en voit encore aujourd'hui sure les anciennes châsses .
form,pl,et pour y réussir il faut comme nous l'avons déjà dit composer dans des cadres dont les formes soient les plus baroques comme les romboïdales ovales très allongées parallélogrammes très peu larges anciens paneaux bien maniérés et chantournés .
form,pl,telle est aussi l'origine des pierers meulières et de celles que nous appellons pierres de champeaux dont les formes sont tout-à-fait baroques ce qui se conçoit aisément lorsqu' on réfléchit sur la manière dont elles sont formées .
form,pl,leurs écailles sont baroques inégales difficiles à ouvrir mais l'intérieur est très délicat et d'un goût exquis .
form,pl,il y a beaucoup d'huîtres à l'isle de france mais les coquilles en sont si baroques qu'on ne peut les ouvrir qu'en les cassant à coups de marteau .
form,pl,mais les coquilles en sont si baroques qu'on ne peut les ouvrir qu'à coups de marteau .
gout,pl,entre ces séparations remplies de figures et sur la bordure de ces tableaux on a pratiqué des ornements dont le goût et la forme sont très baroques .
ornament,pl,mais tous ces blocs se trouvent dans les mêmes circonstances générales c'est-à-dire qu'il sont isolés ou du moins distincts les uns des autres même dans leurs plus grands entassements qu'on voit souvent des bas-reliefs baroques à leur surface et qu'ils se trouvent dans des sables .
ornament,pl,nous ne mettrons pas au nombre des ornements ces masses vagues baroques qu'on ne peut définir et que nous nommons chicorée .
ornament,pl,nous ne mettrons pas au nombre des ornements ces masses vagues baroques que nous nommons chicorée .
ornament,pl,deux urnes à fond bleu et compartiments blancs baroques replis d'arbres de fleurs et de bouquets le tout fort élégant et superbe .
ornament,pl,ce qui choque le goût au premier aspect les morceaux de ce maître ce sont ces bordures gothiques ou baroques dont quelques artistes surtout ceux d'augsbourg et de nuremberg ont infecté tous les arts jusqu'à l'architecture .
ornament,pl,peu à peu toutes les villes les plus considérables de l'europe eurent des horloges ornées et enrichies de différentes machines et de singularités quelquefois assez baroques .
ornament,pl,ces pieux dépouillés de leur écorce sont ou peints de diverses couleurs ou ornés de sculptures baroques .
ornament,pl,cinq racines baroques sculptées à chine et connues sous le nom de mandragores .
ornament,pl,et au lieu d'ornements baroques qu'on y mette du vrai du naturel du singulier du bizarre même sans aller jamais au delà des bornes et on fera du beau du suprenant du prodigieux .
ornament,pl,l'auteur de ce traité s'élève contre les ornements baroques contres ces enroulements et ces volutes contournées qui ne présentent rien dans la nature et qui ne sont qu'un assemblage monstreux de coquilles de plantes et cetera .
ornament,pl,ne croyez pas cependant que je veuile m'ériger en défenseur de tous ces ornements baroques et bizarres qu'on a inventés de nos jours .
ornament,pl,nous commençons enfin à retourner au goût grec dans quelques unes des parties principales de l'architecture ainsi que dans ses ornements après avoir essayé pendant plus de 50 ans des essais continus de membres lourds ou mesquins d'ornements baroques ou entortillés et de formes tourmentés telles que celles des borromini des meissonnier des pineau .
ornament,pl,et malgré les pans coupé arrondis les pilastres sans proportion et les panneaux à moulures baroques .
ornament,pl,il consiste dans une manière d'écusson environné de moulures baroques et d'enroulements difformes .
ornament,pl,le duc de caravita a fait exécuter en pierres les ornements les plus absurdes du genre baroque dans un jardin situé à côté du château royal .
ornament,pl,il n'y a pas jusqu'au bois des chassis de croisées qui veulent aussi se faire de fête et qui se tortuent le plus joliment du monde sans autre avantage que de donner beaucoup de peine au menuisier et de l'embarras au vitrier lorsqu' il lui faut couper des verres dans ces formes baroques .
ornament,pl,du milieu de la décoration formé par un corps en saillie s'élevoit une tour octogone à la chinoise de neuf étages distingués par des corniches baroques aux angles desquelles étaient suspendues des clochettes .
ornament,pl,entre ces séparations remplies de figures et sur la bordure de ces tableaux on a pratiqué des ornements dont le goût et la forme sont très baroques .
other,pl,enfin nos aïeux étaient gothiques nos pères amis de la nature nous sommes singuliers et baroques .
other,pl,divers compliments presque tous assez baroques m'ont paru peu encourageans .
other,pl,il ne m'est point permis de faire perdre le temps à mon lecteur en le régalant d'une farce des systèmes sur cette matière tous également baroques et nullement satisfaisants .
other,pl,c'est que le bons sens ne sauroit se plier à ces tournures baroques se prêter à ces allures si peu naturelles .
other,pl,il faut surtout entasser des expressions incroyables et qui ne ressemblent à rien des tournures baroques des constructions barbares .
other,pl,on reprocha longtemps à crébillon la dureté la sécheresse l'incorrection les tournures baroques les barbarismes .
other,pl,cette lettre et toutes les instances précédentes ont été repondues par des refus ou par des propositions d'arrangements baroques et inacceptables .
other,pl,les beaux vers de monsieur racine sont durs et baroques quand ils sortent de la bouche d'un auvergnat .
other,pl,il nous seroit facile d'amuser l'oisive imbécilité de quelques méchants en citant quelques vers durs ou baroques malins ou irréguliers .
other,pl,mais tout le monde s'accorde à dire que les vers y sont durs baroques faits en dépit du bons sens .
other,pl,ses compagnes se joignent à elle et généralisant la querelle tombent à qui mieux mieux sur tous les auteurs et sur leurs prétendus titres à l'immoralité fondés sur quelques vers innocents ou baroques .
other,pl,mais on peut bien défier tous les furets d'histoires et tous les compilateurs de traits singuliers et baroques de citer quelque personnage riche heureux et bien sain de corps et d'esprit qui se soit tué uniquement par la crainte de devenir malheureux .
other,pl,c'est que par un contraste assez mal-adoit ils ont cru souvent rendre comme on l'a vu la naïveté et l'energie de l'auteur par des tournures triviales ou baroques .
other,pl,l'autre ordonne la manoeuvre en termes si singuliers et baroques qu'on n'y entend rien .
other,pl,c'est ainsi qu'après avoir été déchiré par tant de sons durs et baroques je n'ai pas lu sans plaisir les vers suivants .
