category,sentence,sentence_lemmatized
substance,mais leur forte odeur de musc d'ambre et de civette que l'on ne pouvoit sourtenir sans incommodité a fait que la mode et l'usage s'en sont presque perdus ., mais son fort odeur de musc de ambre et de civette que on ne pouvoir sourtenir sans incommodité avoir faire que le mode et le usage se en être presque perdre .
substance,mais on me dira peut-être qu'on applique souvent un grain de musc ou de civette sur l'ombilic pour faire abbaisser la matrice et pour calmer les vapeurs ., mais on se dire peut-être que on appliquer souvent un grain de musc ou de civette sur le ombilic pour faire abbaisser le matrice et pour calmer le vapeur .
animal,mais scaliger ruel matthiole léon africain busbec aldrovandus et autres modernes veulent que la civette ait été inconnue aux anciens et que ce soit une espèce de chat ., mais scaliger ruel matthiole léon africain busbec aldrovandus et autre moderne vouloir que le civette avoir être inconnu à le ancien et que ce être un espèce de chat .
substance,nous devons néanmoins observer qu'on préfére alors le musc à la civette et qu'on s'en sert plus fréquemment pour parfumer ., il devoir néanmoins observer que on préférer alors le musc à le civette et que on se en servir plus fréquemment pour parfumer .
animal,odeur très-agréable renfermée dans une manière de bourse qui est autour des aines de l'animal qu'on apelle civette ., odeur très-agréable renfermer dans un manière de bourse qui être autour de le aine de le animal que on apeler civette .
plant,on compte trois espèces de cives dont la plus petite se nomme civette ., on compter trois espèce de cive dont le plus petit se nommer civette .
plant,on doit avoir soin de tondre fréquemment la civette même au-delà de la consommation pour avoir des feuilles nouvelles qui sont plus douces que les anciennes ., on devoir avoir soin de tondre fréquemment le civette même au-delà de le consommation pour avoir un feuille nouveau qui être plus doux que le ancien .
substance,on doit choisir la civette récente de bonne consistance de couleur blanche d'une odeur forte et qui n'est point agreable elle jaunit pui elle brunit en vieillissant ., on devoir choisir le civette récent de bon consistance de couleur blanc de un odeur fort et qui ne être point agreable il jaunir pui il brunir en vieillir .
animal,on en avait grossiérement découpé toutes les parties et on n'avait épargné que le sac où la civette porte son parfum ., on en avoir grossiérement découper tout le partie et on ne avoir épargner que le sac où le civette porter son parfum .
substance,on en nourrit en hollande avec du lait et des oeufs afin que la civette qui en sort soit blanche ., on en nourrir en hollande avec du lait et un œuf afin que le civette qui en sortir être blanc .
substance,on fait aussi avec la civette le musc et l'ambre gris incoporés avec une huile par expression un onguent dont on frotte les aines et les lombes pour exciter l'acte vénérien ., on faire aussi avec le civette le musc et le ambre gris incoporer avec un huile par expression un onguent dont on frotter le aine et le lombe pour exciter le acte vénérien .
substance,on n'y donne à ces animaux que des jaunes d'oeufs avec du lait et on prétend que c'est cette nourriture qui rend la civette de ce pays-là plus blanche que celle qui vient d'afrique et des indes orientales parce que ces animaux étant nourris de chair comme il arrive quand ils sont libres ou qu'on les tient enfermés dans des cages cette nourriture contribue infiniment à donner à leur sueur une couleur grise qui se change bientôt en brune ., on ne y donner à ce animal que un jaune de œuf avec du lait et on prétendre que ce être ce nourriture qui rendre le civette de ce pays là plus blanc que celui qui venir de afrique et de le indes oriental parce que ce animal être nourrir de chair comme il arriver quand il être libre ou que on le tenir enfermer dans un cage ce nourriture contribuer infiniment à donner à son sueur un couleur gris qui se changer bientôt en brune .
animal,on ne conçoit pas comment les anciens qui se sont tant étendus sur les propriétés de l'hyène auroient oublié de nous parler de son odeur singuliere si c'eût été la civette ., on ne concevoir pas comment le ancien qui se être tant étendu sur le propriété de le hyène avoir oublier de il parler de son odeur singuliere si ce avoir être le civette .
substance,on ne prescrit jamais actuellement la civette en médecine quoiqu'on l'ait employée autrefois comme corroborante cordiale sudorifique antispasmodique ., on ne prescrire jamais actuellement le civette en médecine quoique on le avoir employer autrefois comme corroborante cordial sudorifique antispasmodique .
substance,on vient de voir que les sacs qui servent à la sécrétion de la matière odorante que produit la civette font au-dessous de l'anus ., on venir de voir que le sac qui servir à le sécrétion de le matière odorant que produire le civette faire au-dessous de le anus .
substance,pour faire cette eau d'odeur on emploie la quintessence d'ambre gris la plus pure et la meilleure qu'il est possible sans mélange de musc et de civette ., pour faire ce eau de odeur on employer le quintessence de ambre gris le plus pur et le meilleur que il être possible sans mélange de musc et de civette .
animal,pour le recueillir on met la civette dans une cage étroite dans laquelle il lui est impossible de se retourner ., pour le recueillir on mettre le civette dans un cage étroit dans lequel il lui être impossible de se retourner .
substance,prenez deux dragmes de bon ambre gris autant de sucre candi demi-dragme de musc et deux grains de civette ., prendre deux dragme de bon ambre gris autant de sucre candi demi-dragme de musc et deux grain de civette .
plant,prenez fleurs de sureau sèches six onces estragon amorti au soleil huit onces ail trois onces civette quatre onces échalottes quatre onces sommités de baume ou menthe-baume une once girofles un gros et demi ., prendre fleur de sureau sec six once estragon amorti à le soleil huit once ail trois once civette quatre once échalotte quatre once sommiter de baume ou menthe-baume un once girofle un gros et demi .
animal,presque tous les naturalites avaient confondu la civette et le zibet et les avaient cru de la même espèce ., presque tout le naturalites avoir confondre le civette et le zibet et le avoir cru de le même espèce .
animal,puisqu'il n'est pas même absolument démontré que la civette et le zibet ne soient pas des variétés d'une espèce unique ., puisque il ne être pas même absolument démontrer que le civette et le zibet ne être pas un variété de un espèce unique .
animal,quelques naturalistes ont compris dans le genre du chien le loup le renard la civette le blaireau la loutre afin de donner une idée des principaux caractères distinctifs de ces animaux quadrupedes par un objet de comparaison bien connu ., quelque naturaliste avoir comprendre dans le genre de le chien le loup le renard le civette le blaireau le loutre afin de donner un idée de le principal caractère distinctif de ce animal quadrupede par un objet de comparaison bien connaître .
substance,si pour charger vos éventails vous vous servez de compositions dans lesquelles il entre plus de civette que d'autre parfums vous ferez usage des fleurs ., si pour charger son éventail il il servir de composition dans lequel il entrer plus de civette que de autre parfum il faire usage un fleur .
substance,si vous ne faites qu'à la civette ou au musc vous ne mettrez qu'une de ces matières dans ladite phiole ou bouteille mais toujours avec de l'esprit-de-vin rectifié ., si il ne faire que à le civette ou à le musc il ne mettre que un de ce matière dans ledit phiole ou bouteille mais toujours avec de le esprit-de-vin rectifier .
substance,suivant carthenser il n'y a presque point de différence entre le musc et la civette ., suivant carthenser il ne y avoir presque point de différence entre le musc et le civette .
plant,toutes les parties de la plante sont de la même forme et dans la même disposition que celles de la civette mais beaucoup plus grandes ., tout le partie de le plante être de le même forme et dans le même disposition que celui de le civette mais beaucoup plus grand .
